{"entries":[],"id":"defaults-category-contracts-review","kind":"category-contract-registry","owner":"bullmoose20","provenance":{"actor":"bullmoose20","evidence_sha256":"6f0053782785677efa7bc0a6bd9bdd1f9e3224ea9ac077bc23879d76a2af5edb","role":"maintainer","source":"M6 review basis; no exact-package approvals included"},"schema_version":1,"version":"1.0.0"}