{"entries":[],"id":"playlist-m3-review","kind":"category-contract-registry","owner":"bullmoose20","provenance":{"actor":"bullmoose20","evidence_sha256":"55256f7878288c1c99e6ca6bb4441b6785220740cf09254885ae378d47d0885e","role":"maintainer","source":"M3 implementation authorization (implementation-authorization.json); exact package awaits review"},"schema_version":1,"version":"1.0.0"}